Full,First,Last,Company,Label,Bio
Jessica Beegle,Jessica,Beegle,Lifepoint Health,Chief Innovation Officer,"Jessica Beegle specializes in helping companies transform and grow their businesses through the adoption of emerging technology, such as cloud computing, artificial intelligence, remote monitoring, and voice, in regulated environments, ranging from
consumer health to clinical care to drug development. She currently serves as Senior Vice President and Chief Innovation Officer at LifePoint Health where she provides leadership and strategic direction to help the company identify and build new technology-enabled solutions that further improve quality, access and health outcomes for patients across its nationwide footprint. In addition to fostering the development of strategic technology
partnerships for the organization, she is also responsible for architecting the company’s enterprise innovation strategy, drives technology investments, and oversees LifePoint’s health tech startup incubator, 25m Health, a joint-venture between LifePoint, Apollo and 25Madison. 

Prior to joining LifePoint, she helped incubate and launch Walgreens Health, a consumer centric, technology-enabled growth business unit launched by Walgreens Boots Alliance in 2021. Jessica also led consumer health efforts at Google, where she helped introduce new features and functionality to support a consumer’s digital health journey across Google’s billion user products (such as Google Search, Maps, Android, YouTube, and Nest), and was the founding member of the Amazon Web Services (AWS) Healthcare & Life Sciences business, where she helped establish AWS as the leading public cloud partner for payors, providers, medical device, pharmaceutical, and digital health companies across the globe. She began her career at General Electric (GE), supporting the growth of GE healthymagination, the $6B cross-company global health strategy.

Jessica has served as a member of the World Economic Forum (WEF) Global Agenda Council for Brain Research, Meta-Council on the Future of Health, Future of the Internet Working Group, Global Shapers, and was a constituent at WEF’s Annual Meeting in Davos. She is an active advisor for companies such as VisualDX, A.Team, and the Consumer Technology Association (CTA) Health Division. Additionally, she volunteers with the Fred Hutchinson Cancer Center and the United Way of Nashville.

Jessica holds a juris doctor (J.D.) from Southern Methodist University Dedman School of Law and a Bachelor of Arts (B.A.) from the University of Georgia. She is a graduate of GE’s
Executive Commercial Leadership Program (ECLP) and the Executive Education Program at
Harvard Business School."
Travis Messina,Travis,Messina,Contessa,President,"Travis is the President of Contessa, a segment of Amedisys (Nasdaq: AMED) focused on high-acuity homecare programs including hospital at home and palliative care. Travis founded Contessa in 2015 with Martin Ventures and served as CEO, leading the company from formation to its sale to Amedisys in 2021. Prior to Contessa, Travis was the Chief Investment Officer of Martin Ventures, a healthcare-focused venture fund. Before joining Martin Ventures, Travis served as Vice President of Development for Vanguard Health Systems, where he focused on leading the diligence efforts for acute care and ambulatory acquisitions. Travis was also a member of the Healthcare Investment Banking Group at Signal Hill Capital and worked in the Mergers & Acquisitions group at SunTrust Robinson Humphrey."
Shikha Anand,Shikha,Anand,Zeph Stealth,Co-founder and Chief Medical Officer,"Shikha is currently the co-founder of a stealth medical device company, and an advisor and fractional chief medical officer to health technology companies, with a focus on underrepresented founders. She is a startup mentor at the Harvard Innovation Lab and Stanford’s Master in Clinical Informatics Management. A practicing physician, Dr. Anand is board-certified in both Clinical Informatics and Pediatrics. She has previously led health innovation, equity, quality, and informatics initiatives at Withings (Global Chief Medical Officer), Aetna/ CVS (Chief Medical Officer, Consumer Health Products), and Walmart (National Medical Director). As an expert in diversity, equity, and inclusion, she brings a unique perspective on how data and technology can be used to empower and improve the health of diverse populations at scale."